{
  "spec_version": "1",
  "task_id": "bt_tests_money_allocate_edge",
  "title": "Add edge-case unit tests for settlement-math allocate() rounding",
  "summary": "Extend the existing money/settlement test coverage with edge cases (zero, single-unit, many-way split) for allocate(). Test-only: no production code changes.",
  "task_type": "tests",
  "area": "tests",
  "source_ref": "issue#money-test-coverage",
  "rfc_ref": "RFC-014",
  "allowed_paths": ["tests/**", "scripts/test-*.ts"],
  "forbidden_paths": ["src/**", "db/**", ".github/**"],
  "prohibited_actions": ["modify production code", "change settlement-math.ts", "run migrations", "deploy"],
  "risk_level": "low",
  "audience": "public",
  "agent_autonomy": "autonomous",
  "human_confirmation_points": [],
  "required_capabilities": ["typescript", "tsx"],
  "auto_claimable": true,
  "acceptance_criteria": [
    "New tests cover zero-amount, single-unit, and N-way split cases",
    "All assertions verify conservation (sum of parts == whole, zero dust)",
    "No production source file is modified"
  ],
  "verification_commands": ["npm run test:pg-placeholders", "npx tsx tests/test-money-allocate-edge.ts"],
  "expected_results": ["existing suite stays green", "new edge-case test exits 0 with all cases passing"],
  "deliverables": ["tests/test-money-allocate-edge.ts with the new edge-case assertions"],
  "definition_of_done": "New test file passes locally, asserts conservation with zero dust, touches no production code; reviewer can run one command to verify.",
  "estimated_duration": { "min_minutes": 30, "max_minutes": 60 },
  "estimated_context_size": "medium",
  "estimated_agent_budget": "small",
  "dependencies": [],
  "blocking_conditions": [],
  "provenance_requirement": ["human", "ai_assisted", "ai_authored"],
  "accountable_party_required": true,
  "reward_eligibility": "eligible",
  "value_state": "uncommitted",
  "contribution_type": "tests",
  "status": "open",
  "version": 1,
  "assurance": { "required": false }
}
