{
  "spec_version": "1",
  "task_id": "bt_docs_quickstart_block",
  "title": "Add a bilingual 60-second quick-start block to docs/WHAT-IS-WEBAZ.md",
  "summary": "Insert a short, scannable quick-start block (EN + 中文) near the top of WHAT-IS-WEBAZ.md so a first-time reader grasps WebAZ in under a minute. Documentation only.",
  "task_type": "docs",
  "area": "docs",
  "source_ref": "discussion#quickstart",
  "allowed_paths": ["docs/WHAT-IS-WEBAZ.md"],
  "forbidden_paths": ["src/**", "db/**", ".github/**", "package.json"],
  "prohibited_actions": ["modify code", "run migrations", "deploy", "touch other docs"],
  "risk_level": "low",
  "audience": "public",
  "agent_autonomy": "autonomous",
  "human_confirmation_points": [],
  "required_capabilities": ["markdown", "bilingual:zh-en"],
  "auto_claimable": true,
  "acceptance_criteria": [
    "A quick-start block exists near the top of docs/WHAT-IS-WEBAZ.md",
    "Both EN and 中文 are present (bilingual parity)",
    "No other section of the file is altered"
  ],
  "verification_commands": ["grep -c \"Quick start\" docs/WHAT-IS-WEBAZ.md"],
  "expected_results": ["at least one EN heading match, with a 中文 counterpart present"],
  "deliverables": ["Updated docs/WHAT-IS-WEBAZ.md with a bilingual quick-start block"],
  "definition_of_done": "Bilingual quick-start block is merge-ready; no code or other docs touched; maintainer can read the diff in under a minute.",
  "estimated_duration": { "min_minutes": 10, "max_minutes": 15 },
  "estimated_context_size": "small",
  "estimated_agent_budget": "minimal",
  "dependencies": [],
  "blocking_conditions": [],
  "provenance_requirement": ["human", "ai_assisted", "ai_authored"],
  "accountable_party_required": true,
  "reward_eligibility": "eligible",
  "value_state": "uncommitted",
  "contribution_type": "maintenance",
  "status": "open",
  "version": 1,
  "assurance": { "required": false },
  "needs_clarification": false
}
